### ISSUE TITLE
[Bug]: ARK crossplay not working (timeout)

### ISSUE THREAD

**Issue by VibeGAMESNL** [parkervcp/eggs#1297]
### Panel Version

1.5.1

### Wings Version

1.4.7

### Service

game_eggs/steamcmd_servers/ark_survival_evolved

### Modified

No, I did not modify the egg

### Expected Behavior

It should connect when the crossplay argument is set

### Actual Behavior

When you try to connect to an ARK server via the epic game store version of ARK, you get an timeout error: 
![](https://i.imgur.com/Z4OwrJi.png)

Joining via steam version works but if you set the -crossplay argument epic players should also be able to join.

### Steps To Reproduce

1. Create a ark server using the parker ark egg
2. Add "-crossplay" to the ADDITIONAL ARGUMENTS.
3. Restart the ARK server
4. Open the Epic game store version of ARK
5. join a random server
6. Press TAB
7. Enter: open ip:port
8. It will try to connect now

### Relevant log output

```shell
tcpdump shows it is try to "ping" the server but no response.

14:13:26.593801 IP xx.xxx.118.106.53375 > xx.xxx.61.91.30004: UDP, length 512
14:13:27.092668 IP xx.xxx.118.106.53375 > xx.xxx.61.91.30004: UDP, length 512
14:13:27.597458 IP xx.xxx.118.106.53375 > xx.xxx.61.91.30004: UDP, length 512
14:13:28.104349 IP xx.xxx.118.106.53375 > xx.xxx.61.91.30004: UDP, length 512
14:13:28.610489 IP xx.xxx.118.106.53375 > xx.xxx.61.91.30004: UDP, length 512
14:13:29.112909 IP xx.xxx.118.106.53375 > xx.xxx.61.91.30004: UDP, length 512
14:13:29.618943 IP xx.xxx.118.106.53375 > xx.xxx.61.91.30004: UDP, length 512
14:13:30.128321 IP xx.xxx.118.106.53375 > xx.xxx.61.91.30004: UDP, length 512
14:13:30.625019 IP xx.xxx.118.106.53375 > xx.xxx.61.91.30004: UDP, length 512
14:13:31.132199 IP xx.xxx.118.106.53375 > xx.xxx.61.91.30004: UDP, length 512
```

**Comment by VibeGAMESNL** [comment]
Instead of joining using the query port, you need to join with the server port via epic. Problem solved :(

**Comment by gOOvER** [comment]
> Instead of joining using the query port, you need to join with the server port via epic. Problem solved :(

THen u can close this Report ;)
