### ISSUE TITLE
[Bug]: Enshrouded don't get listed

### ISSUE THREAD

**Issue by TheCherry** [parkervcp/eggs#2688]
### Panel Version

1.11.5

### Wings Version

 	1.11.8

### Service

Enshrouded

### Modified

Yes, I modified the egg (will provide details below)
Tried a another Public IP for the setting. Didn't work.

### Expected Behavior

Get listed in the browser.

### Actual Behavior

Dosn't get listed in the server browser.

### Steps To Reproduce

Just install a server.
Ports are all fine.

Here is my outlut log:

https://pastebin.com/jeZBkZjA

### Install logs

https://pteropaste.com/jx8ms18qn1wv

**Comment by gOOvER** [comment]
not an egg issue. Check your ports

**Comment by TheCherry** [comment]
ports should be fine
15636 + 15637

**Comment by gOOvER** [comment]
`wine: Unhandled illegal instruction at address 00000001406728B4 (thread 030c), starting debugger...`

Your KVM VM must run in CPU hostmode

**Comment by TheCherry** [comment]
Thx, the error disappear.
Seems that the server still doesn't come online.

```
[guid_registry] VoxelBlueprintRegistry: Finished loading entry e284b901-c3dd-428
2-8a4e-0a618e5763f5.
[guid_registry] VoxelBlueprintRegistry: Finished loading entry 27a9e067-4b9f-45c
f-b966-208a5ecbd53b.
[guid_registry] VoxelBlueprintRegistry: Finished loading entry 85e3baea-7c93-4d6
f-b1be-42f79b036761.
[guid_registry] VoxelBlueprintRegistry: Finished loading entry 28c4b2ca-4a01-4ba
9-9e05-49c871df6904.
[guid_registry] VoxelBlueprintRegistry: Finished loading entry ec28c5d5-9d23-413
e-b238-781157fb2f65.
[guid_registry] VoxelBlueprintRegistry: Finished loading entry 5d9bd376-5b7f-4db
4-8f2e-6a3e564194b1.
[guid_registry] VoxelBlueprintRegistry: Finished loading entry 34aa0c3c-9a88-4f8
b-a070-64827a5fdabf.
[online] Server connected to Steam successfully
[online] Server is not VAC Secure!
[online] Server SteamId: 90179850451819549
[online] Public ipv4: XXX.XXX.XXX.XXX
[OnlineProviderSteam] 'Initialize' (up)!
[OnlineProviderSteam] 'JoinOrCreateGame' (up)!
[OnlineProviderSteam] 'SetLobbyData' (up)!
[OnlineProviderSteam] 'JoinLocalPlayers' (up)!
[OnlineProviderSteam] 'ConnectToPeers' (up)!
[OnlineProviderSteam] finished transition from 'Uninitialized' to 'InGame' (curr
ent='InGame')!
[Session] 'HostOnline' (up)!
container@pterodactyl~ Server marked as running...
[Session] finished transition from 'Lobby' to 'Host_Online' (current='Host_Onlin
e')!
[online] Session accepted with peer ( id 76561199080642551 ).
[online] Added Peer #0.
STEAMPS3 - AsyncTCPSocket created
[online] Session failed for peer #0 with error 4.
STEAMPS3 - AsncTCPSocket destroyed
[online] Removed Peer #0.
```

**Comment by gOOvER** [comment]
```
[online] Session failed for peer #0 with error 4.
STEAMPS3 - AsncTCPSocket destroyed
[online] Removed Peer #0.
```

No fix for this right now, but still not an egg issue

**Comment by TheCherry** [comment]
Mhh ok.
There is for sure a communication:
```bash
tcpdump -n port 15636 or port 15637
21:04:24.061184 IP 109.250.153.136.56468 > XXX.XXX.XXX.XXX.15637: UDP, length 25
21:04:24.067351 IP XXX.XXX.XXX.XXX.15637 > 109.250.153.136.56468: UDP, length 9
21:04:24.203111 IP 109.250.153.136.56468 > XXX.XXX.XXX.XXX.15637: UDP, length 29
21:04:24.217456 IP XXX.XXX.XXX.XXX.15637 > 109.250.153.136.56468: UDP, length 85
21:04:24.344375 IP 109.250.153.136.56469 > XXX.XXX.XXX.XXX.15637: UDP, length 9
21:04:24.367765 IP XXX.XXX.XXX.XXX.15637 > 109.250.153.136.56469: UDP, length 9
21:04:24.483926 IP 109.250.153.136.56469 > XXX.XXX.XXX.XXX.15637: UDP, length 9
21:04:24.518107 IP XXX.XXX.XXX.XXX.15637 > 109.250.153.136.56469: UDP, length 6
21:04:26.182996 IP 84.132.31.11.50849 > XXX.XXX.XXX.XXX.15637: UDP, length 25
21:04:26.215894 IP XXX.XXX.XXX.XXX.15637 > 84.132.31.11.50849: UDP, length 9
21:04:26.249299 IP 84.132.31.11.50849 > XXX.XXX.XXX.XXX.15637: UDP, length 29
21:04:26.265941 IP XXX.XXX.XXX.XXX.15637 > 84.132.31.11.50849: UDP, length 85
21:04:31.460230 IP 82.64.73.36.19165 > XXX.XXX.XXX.XXX.15637: UDP, length 25
21:04:31.501611 IP XXX.XXX.XXX.XXX.15637 > 82.64.73.36.19165: UDP, length 9
21:04:31.571395 IP 82.64.73.36.19165 > XXX.XXX.XXX.XXX.15637: UDP, length 29
21:04:31.601522 IP XXX.XXX.XXX.XXX.15637 > 82.64.73.36.19165: UDP, length 85
21:04:34.064486 IP 109.250.153.136.55600 > XXX.XXX.XXX.XXX.15637: UDP, length 25
21:04:34.092863 IP XXX.XXX.XXX.XXX.15637 > 109.250.153.136.55600: UDP, length 9
21:04:34.224572 IP 109.250.153.136.55600 > XXX.XXX.XXX.XXX.15637: UDP, length 29
21:04:34.242295 IP XXX.XXX.XXX.XXX.15637 > 109.250.153.136.55600: UDP, length 85
21:04:34.469480 IP 109.250.153.136.55601 > XXX.XXX.XXX.XXX.15637: UDP, length 9
21:04:34.492867 IP XXX.XXX.XXX.XXX.15637 > 109.250.153.136.55601: UDP, length 9
21:04:44.979839 IP 76.38.173.147.11763 > XXX.XXX.XXX.XXX.15637: UDP, length 25
```

**Comment by TheCherry** [comment]
got it working.
the IP 0.0.0.0 didn't worked.
with the IP 127.0.0.1 its working. Maybe it should added as a user parameter with the IP.

**Comment by MajorTom027** [comment]
Each time I start the server the ip gets reset to 0.0.0.0. Do you know I can keep the ip 127.0.0.1?

**Comment by gOOvER** [comment]
> Each time I start the server the ip gets reset to 0.0.0.0. Do you know I can keep the ip 127.0.0.1?

0.0 0.0 contains 127.0.0.1 

you must edit the egg

**Comment by QuintenQVD0** [comment]
> Each time I start the server the ip gets reset to 0.0.0.0. Do you know I can keep the ip 127.0.0.1?

Thats normal. We hard locked that. As 0.0.0.0 will then follow the allocation. 127.0.0.1 is localhost only so then you will never be able to connect. 127.0.0.1 eoes not preforme the same in Pterodactyl as on a direct hosted machine.

**Comment by LucasAlumni** [comment]
Hi ! 

I have the same problem my server isn't visible.

`
{
    "gamePort": 15636,
    "ip": "127.0.0.1",
    "logDirectory": "./logs",
    "name": "demoensh",
    "password": "qwerty",
    "queryPort": 15637,
    "saveDirectory": "./savegame",
    "slotCount": 8
}
`

I tried to change 0.0.0.0 to 127.0.0.1, but it is not working for me.

**Comment by jibbius** [comment]
Fix for me was as follows:

Within Pterodactyl Admin, you need to ensure that the QueryPort (default 15637) has also been allocated to the server.

Admin -> Servers -> Enshrouded -> Build Configuration , look for Allocate Additional Ports.

**Comment by LucasAlumni** [comment]
Thx dude !

**Comment by QuintenQVD0** [comment]
Thats always the case?

**Comment by TheCherry** [comment]
> > Each time I start the server the ip gets reset to 0.0.0.0. Do you know I can keep the ip 127.0.0.1?
> 
> Thats normal. We hard locked that. As 0.0.0.0 will then follow the allocation. 127.0.0.1 is localhost only so then you will never be able to connect. 127.0.0.1 eoes not preforme the same in Pterodactyl as on a direct hosted machine.

For me that was exactly the solution. Change from 0.0.0.0 to 127.0.0.1 and everything worked.
Thats my host file on the wings server:
```
cat /etc/hosts
127.0.0.1       localhost
127.0.1.1       ptero-main

# The following lines are desirable for IPv6 capable hosts
::1     localhost ip6-localhost ip6-loopback
ff02::1 ip6-allnodes
ff02::2 ip6-allrouters
```

Idk if you mean that by the "allocation".
